input,output
"SecureHypertextTransferProtocol(S-HTTP)isanobsoletealternativetotheHTTPSprotocolforencryptingwebcommunicationscarriedovertheInternet.ItwasdevelopedbyEricRescorlaandAllanM.SchiffmanatEITin1994andpublishedin1999asRFC2660.EventhoughS-HTTPwasfirsttomarket,Netscape'sdominanceofthebrowsermarketledtoHTTPSbecomingthedefactomethodforsecuringwebcommunications.","Secure Hypertext Transfer Protocol (S-HTTP) is an obsolete alternative to the HTTPS protocol for encrypting web communications carried over the Internet. It was developed by Eric Rescorla and Allan M. Schiffman at EIT in 1994  and published in 1999 as RFC 2660. Even though S-HTTP was first to market, Netscape's dominance of the browser market led to HTTPS becoming the de facto method for securing web communications.  "
"ThePetticoatAffair(alsoknownastheEatonAffair)wasapoliticalscandalinvolvingmembersofPresidentAndrewJackson'sCabinetandtheirwives,from1829to1831.LedbyFlorideCalhoun,wifeofVicePresidentJohnC.Calhoun,thesewomen,dubbedthe""Petticoats"",sociallyostracizedSecretaryofWarJohnEatonandhiswife,PeggyEaton,overdisapprovalofthecircumstancessurroundingtheEatons'marriageandwhattheydeemedherfailuretomeetthe""moralstandardsofaCabinetWife"".ThePetticoatAffairrattledtheentireJacksonAdministrationandeventuallyledtotheresignationofallbutoneCabinetmember.TheordealfacilitatedMartinVanBuren'srisetothepresidencyandwasinpartresponsibleforVicePresidentCalhoun'stransformationfromanationwidepoliticalfigurewithpresidentialaspirationsintoasectionalleaderofthesouthernstates.","The Petticoat Affair (also known as the Eaton Affair) was a political scandal involving members of President Andrew Jackson's Cabinet and their wives, from 1829 to 1831.  Led by Floride Calhoun, wife of Vice President John C. Calhoun, these women, dubbed the ""Petticoats"", socially ostracized Secretary of War John Eaton and his wife, Peggy Eaton, over disapproval of the circumstances surrounding the Eatons' marriage and what they deemed her failure to meet the ""moral standards of a Cabinet Wife"". The Petticoat Affair rattled the entire Jackson Administration and eventually led to the resignation of all but one Cabinet member.  The ordeal facilitated Martin Van Buren's rise to the presidency and was in part responsible for Vice President Calhoun's transformation from a nationwide political figure with presidential aspirations into a sectional leader of the southern states."
"TheCongressionalNextGen9-1-1Caucus,aUnitedStatesCongresscaucus,workstoimprovethe9-1-1phonesystemandemergencyresponsesystems.ThecaucusisheadedbySenatorsRichardBurr(R-NC)andAmyKlobuchar(D-MN)andRepresentativesDanBishop(R-NC)andAnnaEshoo(D-CA).","The Congressional NextGen 9-1-1 Caucus, a United States Congress caucus, works to improve the 9-1-1 phone system and emergency response systems. The caucus is headed by Senators Richard Burr (R-NC) and Amy Klobuchar (D-MN) and Representatives Dan Bishop (R-NC) and Anna Eshoo (D-CA)."
"PatrickJosephO'Kane(18841970)wasamemberoftheNewZealandLegislativeCouncilfrom8September1941to7September1948;and8September1948to31December1950,whentheCouncilwasabolished.HewasappointedbytheFirstLabourGovernment.HewasfromFrasertowninHawkesBay.","Patrick Joseph O'Kane (18841970) was a member of the New Zealand Legislative Council from 8 September 1941 to 7 September 1948; and 8 September 1948 to 31 December 1950, when the Council was abolished. He was appointed by the First Labour Government.He was from Frasertown in Hawkes Bay."
JeanLeniolJeudy(born1958)isoneofthreemembersoftheNewHampshireHouseofRepresentativesforHillsborough10(Ward3inManchester).,Jean Leniol Jeudy (born 1958) is one of three members of the New Hampshire House of Representatives for Hillsborough 10 (Ward 3 in Manchester).
MbaoniisasettlementinKenya'sCoastProvince.,Mbaoni is a settlement in Kenya's Coast Province.
"TheFaroeIslandscompetedatthe2008SummerParalympicsinBeijing,China,butdidnotwinamedal.Theteamconsistedofasinglecompetitor,HeidiAndreasen,whotookpartinfourswimmingevents.","The Faroe Islands competed at the 2008 Summer Paralympics in Beijing, China, but did not win a medal. The team consisted of a single competitor, Heidi Andreasen, who took part in four swimming events."
"The1917ArkansasRazorbacksfootballteamrepresentedtheUniversityofArkansasintheSouthwestConference(SWC)duringthe1917collegefootballseason.IntheirfirstyearunderheadcoachNormanC.Paine,theRazorbackscompileda511record(011againstSWCopponents),finishedinlastplaceintheSWC,andoutscoredtheiropponentsbyacombinedtotalof118to27.","The 1917 Arkansas Razorbacks football team represented the University of Arkansas in the Southwest Conference (SWC) during the 1917 college football season. In their first year under head coach Norman C. Paine, the Razorbacks compiled a 511 record (011 against SWC opponents), finished in last place in the SWC, and outscored their opponents by a combined total of 118 to 27."
"Twohumanpollsmakeupthe200708NCAADivisionIwomen'sbasketballrankings,theAPPollandtheCoachesPoll,inadditiontovariouspublications'preseasonpolls.Asthe2007-08basketballseasonprogresses,rankingsareupdatedweekly.","Two human polls make up the 200708 NCAA Division I women's basketball rankings, the AP Poll and the Coaches Poll, in addition to various publications' preseason polls.  As the 2007-08 basketball season progresses, rankings are updated weekly."
"The2020UnitedStatesHouseofRepresentativeselectionsinIllinoiswereheldonNovember3,2020,toelectthe18U.S.representativesfromthestateofIllinois,onefromeachofthestate's18congressionaldistricts.Theelectionscoincidedwiththe2020U.S.presidentialelection,aswellasotherelectionstotheHouseofRepresentatives,electionstotheUnitedStatesSenate,variousstateandlocalelections,andtheIllinoisFairTax.","The 2020 United States House of Representatives elections in Illinois were held on November 3, 2020, to elect the 18 U.S. representatives from the state of Illinois, one from each of the state's 18 congressional districts. The elections coincided with the 2020 U.S. presidential election, as well as other elections to the House of Representatives, elections to the United States Senate, various state and local elections, and the Illinois Fair Tax."
AnacampsislithodeltaisamothofthefamilyGelechiidae.ItwasdescribedbyEdwardMeyrickin1922.ItisfoundinPeru.,Anacampsis lithodelta is a moth of the family Gelechiidae. It was described by Edward Meyrick in 1922. It is found in Peru.
"TheYonderMountainStringBandisanAmericanprogressivebluegrassgroupfromNederland,Colorado.ComposedofDaveJohnston,BenKaufmann,AdamAijala,andNickPiccininni,thebandhasreleasedfivestudioalbumsandseveralliverecordingstodate.","The Yonder Mountain String Band is an American progressive bluegrass group from Nederland, Colorado. Composed of Dave Johnston, Ben Kaufmann, Adam Aijala, and Nick Piccininni, the band has released five studio albums and several live recordings to date."
"TheargumentfrommoralityisanargumentfortheexistenceofGod.Argumentsfrommoralitytendtobebasedonmoralnormativityormoralorder.ArgumentsfrommoralnormativityobservesomeaspectofmoralityandarguethatGodisthebestoronlyexplanationforthis,concludingthatGodmustexist.Argumentsfrommoralorderarebasedontheassertedneedformoralordertoexistintheuniverse.Theyclaimthat,forthismoralordertoexist,Godmustexisttosupportit.Theargumentfrommoralityisnoteworthyinthatonecannotevaluatethesoundnessoftheargumentwithoutattendingtoalmosteveryimportantphilosophicalissueinmeta-ethics.GermanphilosopherImmanuelKantdevisedanargumentfrommoralitybasedonpracticalreason.Kantarguedthatthegoalofhumanityistoachieveperfecthappinessandvirtue(thesummumbonum)andbelievedthatanafterlifemustexistinorderforthistobepossible,andthatGodmustexisttoprovidethis.InhisbookMereChristianity,C.S.Lewisarguedthat""consciencerevealstousamorallawwhosesourcecannotbefoundinthenaturalworld,thuspointingtoasupernaturalLawgiver.""Lewisarguedthatacceptingthevalidityofhumanreasonasagivenmustincludeacceptingthevalidityofpracticalreason,whichcouldnotbevalidwithoutreferencetoahighercosmicmoralorderwhichcouldnotexistwithoutaGodtocreateand/orestablishit.Arelatedargumentisfromconscience;JohnHenryNewmanarguedthattheconsciencesupportstheclaimthatobjectivemoraltruthsexistbecauseitdrivespeopletoactmorallyevenwhenitisnotintheirowninterest.Newmanarguedthat,becausetheconsciencesuggeststheexistenceofobjectivemoraltruths,Godmustexisttogiveauthoritytothesetruths.ContemporarydefendersoftheargumentfrommoralityareGrahamWard,AlisterMcGrathandWilliamLaneCraig.","The argument from morality is an argument for the existence of God. Arguments from morality tend to be based on moral normativity or moral order. Arguments from moral normativity observe some aspect of morality and argue that God is the best or only explanation for this, concluding that God must exist. Arguments from moral order are based on the asserted need for moral order to exist in the universe. They claim that, for this moral order to exist, God must exist to support it. The argument from morality is noteworthy in that one cannot evaluate the soundness of the argument without attending to almost every important philosophical issue in meta-ethics. German philosopher Immanuel Kant devised an argument from morality based on practical reason. Kant argued that the goal of humanity is to achieve perfect happiness and virtue (the summum bonum) and believed that an afterlife must exist in order for this to be possible, and that God must exist to provide this. In his book Mere Christianity, C. S. Lewis argued that ""conscience reveals to us a moral law whose source cannot be found in the natural world, thus pointing to a supernatural Lawgiver."" Lewis argued that accepting the validity of human reason as a given must include accepting the validity of practical reason, which could not be valid without reference to a higher cosmic moral order which could not exist without a God to create and/or establish it. A related argument is from conscience; John Henry Newman argued that the conscience supports the claim that objective moral truths exist because it drives people to act morally even when it is not in their own interest. Newman argued that, because the conscience suggests the existence of objective moral truths, God must exist to give authority to these truths. Contemporary defenders of the argument from morality are Graham Ward, Alister McGrath and William Lane Craig."
"ThePanaadStadium(Tagalog:[pnaad]),alsosometimesspelledasPana-ad,namedaftertheparkwherethestadiumissituatedin,isamulti-purposestadiuminBarangayMansilingan,Bacolod,Philippines.PanaadhostedvariousinternationalsportingeventsparticularlyfootballwhenBacolodco-hostedthe2005SoutheastAsianGamesandthe2012AFCChallengeCupqualificationagainstMongolia.ThestadiumwasaformerhometoCeres-NegrosF.C.","The Panaad Stadium (Tagalog: [pnaad]), also sometimes spelled as Pana-ad, named after the park where the stadium is situated in, is a multi-purpose stadium in Barangay Mansilingan, Bacolod, Philippines.Panaad hosted various international sporting events particularly football when Bacolod co-hosted the 2005 Southeast Asian Games and the 2012 AFC Challenge Cup qualification against Mongolia. The stadium was a former home to Ceres-Negros F.C."
"CoahomaEarlyCollegeHighSchool(CECHS),formerlyCoahomaAgriculturalHighSchool(CAHS),isapublicsecondaryschoolinunincorporatedCoahomaCounty,Mississippi(UnitedStates),withaClarksdalepostaladdress.TheschoolisdesignatedasapartoftheCoahomaAgriculturalHighSchoolDistrict(ASD#1402),andoperatedbyCoahomaCommunityCollege.Previouslyitwas,asof2000,oneofthreeindependentlyfunctioningagriculturalhighschoolsinthestateofMississippi.Theschoolhasitsownfacilities,instructionalandadministrativepersonnel,andstudentprograms.Itshareslibraryfacilitieswiththecollege.WhenitwasstillCAHS,theschooloperatedtheCoahomaEarlyCollegeHighSchoolprogram.OnJuly1,2018,theoriginalCoahomaCountyAgriculturalHighSchoolwasdissolved,withtheCoahomaEarlyCollegeHighSchooltakingitsplace.","Coahoma Early College High School (CECHS), formerly Coahoma Agricultural High School (CAHS), is a public secondary school in unincorporated Coahoma County, Mississippi (United States), with a Clarksdale postal address. The school is designated as a part of the Coahoma Agricultural High School District (ASD #1402), and operated by Coahoma Community College. Previously it was, as of 2000, one of three independently functioning agricultural high schools in the state of Mississippi. The school has its own facilities, instructional and administrative personnel, and student programs. It shares library facilities with the college. When it was still CAHS, the school operated the Coahoma Early College High School program. On July 1, 2018, the original Coahoma County Agricultural High School was dissolved, with the Coahoma Early College High School taking its place.  "
"TheNorthernMarianaIslandscompetedatthe2019WorldAquaticsChampionshipsinGwangju,SouthKoreafrom12to28July.","The Northern Mariana Islands competed at the 2019 World Aquatics Championships in Gwangju, South Korea from 12 to 28 July."
"VirtualDeepSeaFishingisa1998fishingvideogamebyKoreandeveloperTaffSystem,releasedinEnglish-speakingcountriesin1999byInterplayProductionsThegameispartofthepublisher'sNakksigwangseriesoffishingvideogames,andthefirsttobedistributedoutsideofSouthKorea.","Virtual Deep Sea Fishing  is a 1998 fishing video game by Korean developer Taff System, released in English-speaking countries in 1999 by Interplay Productions The game is part of the publisher's Nakksigwang series of fishing video games, and  the first to be distributed outside of South Korea.  "
"NHSCOVID-19isavoluntarycontacttracingappformonitoringthespreadoftheCOVID-19pandemicinEnglandandWales.Ithasbeenavailablesince24September2020forAndroidandiOSsmartphones,andcanbeusedbyanyoneaged16orover.Twoversionsoftheapphavebeencreated.ThefirstwascommissionedbyNHSXanddevelopedbythePivotaldivisionofAmericansoftwarecompanyVMware.ApilotdeploymentwasbeguninMay2020,buton18JunedevelopmentoftheappwasabandonedinfavourofaseconddesignusingtheApple/GoogleExposureNotificationsystem.ScotlandandNorthernIrelandhaveseparatecontacttracingapps.","NHS COVID-19 is a voluntary contact tracing app for monitoring the spread of the COVID-19 pandemic in England and Wales. It has been available since 24 September 2020 for Android and iOS smartphones, and can be used by anyone aged 16 or over.Two versions of the app have been created. The first was commissioned by NHSX and developed by the Pivotal division of American software company VMware. A pilot deployment was begun in May 2020, but on 18 June development of the app was abandoned in favour of a second design using the Apple/Google Exposure Notification system. Scotland and Northern Ireland have separate contact tracing apps."
"UmmannoorisavillageandgrampanchayatinKollamdistrictinthestateofKerala,India.ItcomesunderKottarakkaraassembly,MavelikkaraparliamentaryconstituencyandVettikkavalablockpanchayat.TheplacehaveagoodfunctionalVillageofficetoo.Ummannoorvillagehaspopulationof17406aspertheCensusIndia2011.UmmannoorisknownforfarmingandagriculturaltradelikeGinger,Blackpepper,Paddy,Rubberetc.St.JohnsHighersecondaryisoneoftheoldestschoolinthearea.AgoodPrimaryHelthcentreisfunctioningnearUmmannoorvillageoffice.","Ummannoor  is a village and gram panchayat in Kollam district in the state of Kerala, India.It comes under Kottarakkara assembly, Mavelikkara parliamentary constituency and Vettikkavala block panchayat. The place have a good functional Village office too. Ummannoor village has population of 17406 as per the Census India 2011. Ummannoor is known for farming and agricultural trade like Ginger, Black pepper, Paddy, Rubber etc. St.Johns Higher secondary is one of the oldest school in the area. A good Primary Helth centre is functioning near Ummannoor village office."
"Lapsangsouchong(;Chinese:;pinyin:zhngshnxiozhng)isablackteaconsistingofCamelliasinensisleavesthataresmoke-driedoverapinewoodfire.Thissmokingisaccomplishedeitherasacoldsmokeoftherawleavesastheyareprocessedorasahotsmokeofpreviouslyprocessed(witheredandoxidized)leaves.Theintensityofthesmokearomacanbevariedbylocatingtheleavescloserorfarther(orhigherorlowerinamulti-levelfacility)fromthesourceofheatandsmokeorbyadjustingthedurationoftheprocess.Theflavourandaromaoflapsangsouchongisdescribedascontainingempyreumaticnotes,includingwoodsmoke,pineresin,smokedpaprika,anddriedlongan;itmaybemixedwithmilkbutisnotbitterandusuallynotsweetenedwithsugar.TheteaoriginatesfromtheWuyiMountainsregionofFujian,ChinaandisconsideredaWuyitea(orbohea).ItisalsoproducedinTaiwan(Formosa).Ithasbeenlabelledassmokedtea(),ZhengShanXiaoZhong,smokysouchong,tarrylapsangsouchong,andlapsangsouchongcrocodile.Whilethetealeafgradingsystemadoptedthetermsouchongtorefertoaparticularleafposition,lapsangsouchongmaybemadewithanyleafoftheCamelliasinensisplant,thoughitisnotunusualforthelowerleaves,whicharelargerandlessflavourful,tobeusedasthesmokingcompensatesforthelowerflavourprofileandthehigherleavesaremorevaluableforuseinunflavouredorunblendedteas.Inadditiontoitsconsumptionasatea,lapsangsouchongisalsousedinstockforsoups,stewsandsaucesorotherwiseasaspiceorseasoning.","Lapsang souchong (; Chinese: ; pinyin: zhngshn xiozhng) is a black tea consisting of Camellia sinensis leaves that are smoke-dried over a pinewood fire. This smoking is accomplished either as a cold smoke of the raw leaves as they are processed or as a hot smoke of previously processed (withered and oxidized) leaves. The intensity of the smoke aroma can be varied by locating the leaves closer or farther (or higher or lower in a multi-level facility) from the source of heat and smoke or by adjusting the duration of the process. The flavour and aroma of lapsang souchong is described as containing empyreumatic notes, including wood smoke, pine resin, smoked paprika, and dried longan; it may be mixed with milk but is not bitter and usually not sweetened with sugar. The tea originates from the Wuyi Mountains region of Fujian, China and is considered a Wuyi tea (or bohea).  It is also produced in Taiwan (Formosa). It has been labelled as smoked tea (), Zheng Shan Xiao Zhong, smoky souchong, tarry lapsang souchong, and lapsang souchong crocodile. While the tea leaf grading system adopted the term souchong to refer to a particular leaf position, lapsang souchong may be made with any leaf of the Camellia sinensis plant, though it is not unusual for the lower leaves, which are larger and less flavourful, to be used as the smoking compensates for the lower flavour profile and the higher leaves are more valuable for use in unflavoured or unblended teas. In addition to its consumption as a tea, lapsang souchong is also used in stock for soups, stews and sauces or otherwise as a spice or seasoning.  "
"CarlBellingrodt(18971971)wasoneofthebest-knownGermanrailwayphotographersofthe20thcenturyandco-founderoftheFederalAssociationofGermanRailwayFriends(BundesverbandDeutscherEisenbahn-Freunde)orBDEF.Heworkedprofessionallyasapoliceofficer,laterswitchingtofinancialmanagement.","Carl Bellingrodt (18971971) was one of the best-known German railway photographers of the 20th century and co-founder of the Federal Association of German Railway Friends (Bundesverband Deutscher Eisenbahn-Freunde) or BDEF. He worked professionally as a police officer, later switching to financial management."
"PhadiaraisatownlocatedinthePunjabprovinceofPakistan.ItislocatedinLahoreDistrictat3114'40N7311'30Ewithanaltitudeof175metres(577feet).NeighbouringsettlementsincludeManak,SinghKhalsaandGobindsar.","Phadiara is a town located in the Punjab province of Pakistan. It is located in Lahore District at 3114'40N 7311'30E with an altitude of 175 metres (577 feet). Neighbouring settlements include Manak, Singh Khalsa and Gobindsar."
"NorthwestField(historicallyNorthwestGuamAirForceBase)isamilitaryairfieldinGuam.Builtin1945duringWorldWarII,theairfieldwasusedasabomberbaseduringandafterthewaruntilitwasclosedin1949.Unitsdeployedtotheairfieldincludedthe315thBombardmentWing(stationedfrom1945to1946)andthe23rdFighterGroup(stationedfrom1946to1949).Sincearound2010,theairfieldhasbeenpartiallyreactivatedandisusedfortrainingrelatedtooperatingatairfieldsinaustereconditions,includingbeingoneofthelocationstohostCopeNorthexercises.","Northwest Field (historically Northwest Guam Air Force Base) is a military airfield in Guam. Built in 1945 during World War II, the airfield was used as a bomber base during and after the war until it was closed in 1949.Units deployed to the airfield included the 315th Bombardment Wing (stationed from 1945 to 1946) and the 23rd Fighter Group (stationed from 1946 to 1949).Since around 2010, the airfield has been partially reactivated and is used for training related to operating at airfields in austere conditions, including being one of the locations to host Cope North exercises.  "
"TheinversiontotheWarburgeffectisacorollarytotheWarburghypothesisorWarburgeffectthatwasdiscoveredinobesity.Warburg'shypothesissuggeststhattumorcellsproliferatequicklyandaggressivelybyobtainingenergyorATP,throughhighglucoseconsumptionandlactateproduction.Whentumorcellsarefoundinanobesityenvironment,theresearchersperceivethatthecellsinsteadofconsumingglucoseinglycolysisproduceglucosethroughgluconeogenesisusingassubstratesthelactatethatinsteadofbeingproducedisconsumed.TheauthorsexplainthatthisisduetotheincreaseinnutrientsthatarefoundinanobeseorganismandthatthecellobtainsenergythroughmorecaloricnutrientssuchasfattyacidsthatarecompletelyoxidizedthroughtheKrebscyclefollowedbyoxidativephosphorylation.","The inversion to the Warburg effect is a corollary to the Warburg hypothesis or Warburg effect that was discovered in obesity. Warburg's hypothesis suggests that tumor cells proliferate quickly and aggressively by obtaining energy or ATP, through high glucose consumption and lactate production. When tumor cells are found in an obesity environment, the researchers perceive that the cells instead of consuming glucose in glycolysis produce glucose through gluconeogenesis using as substrates the lactate that instead of being produced is consumed. The authors explain that this is due to the increase in nutrients that are found in an obese organism and that the cell obtains energy through more caloric nutrients such as fatty acids that are completely oxidized through the Krebs cycle followed by oxidative phosphorylation."
"Thewomen'sshotputcompetitionatthe1968SummerOlympicsinMexicoCity,MexicotookplaceonOctober20.","The women's shot put competition at the 1968 Summer Olympics in Mexico City, Mexico took place on October 20."
NotiophilusdirectusisaspeciesofgroundbeetleinthefamilyCarabidae.ItisfoundinNorthAmerica.,Notiophilus directus is a species of ground beetle in the family Carabidae. It is found in North America.
NintambadaisavillageintheBassarPrefectureintheKaraRegionofnorth-westernTogo.,Nintambada  is a village in the Bassar Prefecture in the Kara Region  of north-western Togo.
"TianxinPavilion(simplifiedChinese:;traditionalChinese:;pinyin:TinxnG)isanancientChinesepavilionlocatedontheancientcitywallofChangsha,Hunan.Thepavilionwasfirstestablishedinthe14thcentury,atthedawnofMingdynasty(13681644),butbecauseofwarandnaturaldisastershasbeenrestoredandrenovatednumeroustimessincethen.Thepresentversionwascompletedin1984.TianxinPavilioniscomposedofthreepavilions,thethreestoriesmainpavilionandthetwostoriesauxiliarypavilions.Thetwosidesareconnectedwithalongcorridor.AlongsidetheYueyangTower,PavilionofPrinceTeng,YellowCraneTower,StorkTower,PenglaiPavilion,DaguanPavilion,YuejiangTower,Xi'anBellandDrumTowerandTianyiPavilion,itisoneofthe""TenFamousChineseHistoricalandCulturalTowersandPavilions""().","Tianxin Pavilion (simplified Chinese: ; traditional Chinese: ; pinyin: Tinxn G) is an ancient Chinese pavilion located on the ancient city wall of Changsha, Hunan. The pavilion was first established in the 14th century, at the dawn of Ming dynasty (13681644), but because of war and natural disasters has been restored and renovated numerous times since then. The present version was completed in 1984. Tianxin Pavilion is composed of three pavilions, the threestories main pavilion and the twostories auxiliary pavilions. The two sides are connected with a long corridor. Alongside the Yueyang Tower, Pavilion of Prince Teng, Yellow Crane Tower, Stork Tower, Penglai Pavilion, Daguan Pavilion, Yuejiang Tower, Xi'an Bell and Drum Tower and Tianyi Pavilion, it is one of the ""Ten Famous Chinese Historical and Cultural Towers and Pavilions"" ()."
"The195758SerieAseasonwasthe24thseasonoftheSerieA,thetopleveloficehockeyinItaly.Sixteamsparticipatedintheleague,andMilan-InterHCwonthechampionship.","The 195758 Serie A season was the 24th season of the Serie A, the top level of ice hockey in Italy. Six teams participated in the league, and Milan-Inter HC won the championship."
